"rt","stimulus","response","phase","trial_type","trial_index","time_elapsed","internal_node_id","prolific_subject_id","study_id","session_id","exit_reason","exit_stage","exit_progress","game_data","emergency_text","keystrokes","mouse_events"
"2989","Welcome!<br><br>In this study, you will play three short video games that were generated by Artificial Intelligence (AI) and complete a short survey after each game.<br><br>Please make sure you are in a quiet environment where you can focus for the duration of the study. Some games may use sound, so please ensure that your device's volume is not muted.<br><br>Press any key to begin."," ","welcome-message","html-keyboard-response","0","2994","0.0-0.0","6501b789e3ddbc0a0b79b925","6987c292780adf01bb926159","69a4fcc2888d846e7607a041","","","","","","",""
"47875","","{""commitment-check"":[""yes""]}","commitment-check","survey","1","50886","0.0-1.0","6501b789e3ddbc0a0b79b925","6987c292780adf01bb926159","69a4fcc2888d846e7607a041","","","","","","",""
"51048","Press any key to proceed to the first video game. Should you encounter a game-breaking bug, please report the issue in the Menu tab to the right of the screen."," ","pre-game-one-message","html-keyboard-response","2","101934","0.0-2.0","6501b789e3ddbc0a0b79b925","6987c292780adf01bb926159","69a4fcc2888d846e7607a041","","","","","","",""
