"rt","stimulus","response","phase","trial_type","trial_index","time_elapsed","internal_node_id","prolific_subject_id","study_id","session_id","exit_reason","exit_stage","exit_progress","game_data","emergency_text","keystrokes","mouse_events"
"2591","Welcome! In this study, you will play three short video games, completing a short survey after each game.<br><br>Please make sure you are in a quiet environment where you can focus for the duration of the study. Some games may use sound, so please ensure that your device's volume is not muted.<br><br>Press any key to begin.","enter","welcome-message","html-keyboard-response","0","2618","0.0-0.0","6930ddbb1de3accea0a61bf6","6987c292780adf01bb926159","69a39bb745c4b849ebe13eb1","","","","","","",""
"2670","","{""commitment-check"":[""yes""]}","commitment-check","survey","1","5307","0.0-1.0","6930ddbb1de3accea0a61bf6","6987c292780adf01bb926159","69a39bb745c4b849ebe13eb1","","","","","","",""
"3852","Press any key to proceed to the first video game. Should you encounter a game-breaking bug, please report the issue in the Menu tab to the right of the screen.","enter","pre-game-one-message","html-keyboard-response","2","9159","0.0-2.0","6930ddbb1de3accea0a61bf6","6987c292780adf01bb926159","69a39bb745c4b849ebe13eb1","","","","","","",""
