"rt","stimulus","response","phase","trial_type","trial_index","time_elapsed","internal_node_id","prolific_subject_id","study_id","session_id","exit_reason","exit_stage","exit_progress","game_data","emergency_text","keystrokes","mouse_events"
"2776","Welcome!<br><br>In this study, you will play three short video games that were generated by Artificial Intelligence (AI) and complete a short survey after each game.<br><br>Please make sure you are in a quiet environment where you can focus for the duration of the study. Some games may use sound, so please ensure that your device's volume is not muted.<br><br>Press any key to begin.","f","welcome-message","html-keyboard-response","0","2780","0.0-0.0","671a6c6227da7c097cfe8caf","6987c292780adf01bb926159","69ade883bea6e1c377374db4","","","","","","",""
"3968","","{""commitment-check"":[""yes""]}","commitment-check","survey","1","6818","0.0-1.0","671a6c6227da7c097cfe8caf","6987c292780adf01bb926159","69ade883bea6e1c377374db4","","","","","","",""
"3824","Press any key to proceed to the first video game. Should you encounter a game-breaking bug, please report the issue in the Menu tab to the right of the screen."," ","pre-game-one-message","html-keyboard-response","2","10643","0.0-2.0","671a6c6227da7c097cfe8caf","6987c292780adf01bb926159","69ade883bea6e1c377374db4","","","","","","",""
