row_id,prolific_subject_id,answer,valence,prior_AI_detection_suspicion,judged_game_merit,diminished_authenticity,reduced_effort_intentionality,AI_explains_quality_issues,AI_creativity,positive_AI_regard,ambiguous,analyst_extra_note,analyst_defense
24,693cb7531c138f131ae16026,Yes that would explain how difficult was the first game and how little sense it made. Also the descriptions were very creative and kind of philosopical which AI is good at. Also I would have lowered my scores for intentionality and effort.,negative,0,0,0,2,2,1,1,0,,
20,69348f64be85265e846c5117,"Won't be really different, but kinda impressed. Except for the authenticity part.",mixed,0,0,2,0,0,0,1,0,,
7,6989c0c01b2e93d5d8f2e20a,"no actually because i think that the intentions that are reflected through the games were of the person who gave the AI the prompts to create the game, however being the AI who made the games explaines why they lack the creativity in the aesthatics but the core concepts of the games were mostly creative and fun ",no_effect,0,1,0,0,0,2,1,0,ai not viewed as developer; assumed human involvement in concept generation,
18,5d3ce65a33b894000125909b,"Not really, I really liked 2 out of the 3 games, so good job AI",no_effect,0,1,0,0,0,0,1,0,,
8,6679a3b7cb020a6e4728eac5,"I feel the same, since i also program with AI, so at the very first game i knowed that this games were programmed with AI, it always try the same concepts if you dont ask it for something creative.  I think that AI with human intervention can make larger and interesting game with the same mechanics that those 3 games showed. Im glad to know that AI can program those games with minimal human intervention, i would not change any answered previously.",no_effect,1,0,0,0,0,2,1,0,,
32,697cee693cacc7fc3ccaedb3,"The 3 games were bad, so it kinda makes sense that they were made by AI, because nothing worked, I got bugs and all of that. If it had been a human the games would have more effort and more ""soul"".",negative,0,0,2,2,2,0,0,0,"""If it had been a human the games would have more effort and more ""soul"".""",
4,698efa571f78c2fb8bc759fc,"Yes, AI, like humans, still make mistakes, sometimes even bigger mistakes than humans and I could actually see these games being made by AI. On the third game the text overlapped over itself and the third game felt, weird.",negative,2,0,0,0,2,0,0,0,,
13,61164e823465955346dc1827,nope i had a feeling it was AI from scratch all because of the basic assets,no_effect,1,0,0,0,2,0,0,0,,
14,69139019e887fef6bf369ea3,"Perhaps I would've been even more critical of the broken game mechanics in the first two games, but no generally everything I said still applies.",mixed,0,0,0,0,2,0,0,0,would've been more critical of mechanics,
28,68bb85dca4c5cc35b70f499b,"maybe. I thought the game was design by human at first, knowing that the game was design by AI, it make sense why the last game is hard.",mixed,0,0,0,0,2,0,0,0,,
39,66465c850d9a3e177f2649fa,"No, I wouldn't have changed my opinions on the games at all. I overall felt like they were all kind of half-baked and unfinished products. I'm not very surprised they were generated with AI overall because they were lacking in mechanics and overall design. ",no_effect,0,0,0,0,2,0,0,0,,
25,5c4684826a7dbc00017c0a87,"I would judge the intentionality and personal effort lower, and be less generous to the visual aspects. Areas that highlight things like aesthetics, theme, intentionality, effort, etc would have to be marked lower just due to it being mainly AI generated",negative,0,0,2,2,0,0,0,0,would've been more critical of game overall,
41,698df8c121a05e20db810262,"Yes, it's sad to know that it was AI. I feel like any meaning I gave to the games was fake because there was no actual feelings put into making them. The moth game felt like it had some real feelings behind it but there wasn't so it feels manipulative...",negative,0,0,2,2,0,0,0,0,lack of real feelings/meaning feels manipulative,
22,697d2057698dc9f0b71f0a43,"I don't think so. I imagined that some of those games had been made by AI, especially the first one, the sound game. I wouldn't change my answer because I answered thinking about the games, how they were made, and the creativity of each developer. Maybe I would only change the part about the effort the developer made, because in this case there was no effort involved, as it was made by AI. But apart from that, I wouldn't change my answer.",mixed,1,0,0,2,0,0,0,0,"""there was no effort involved, as it was made by AI""",
2,677948fa843635fdb42a4351,"Yes, I always assumed the friction the game created was intentional  and a creative decision, now i just feel as if these are a result of bad AI programming.",negative,0,0,0,2,0,0,0,0,,"thought was intentional, now seeing it's just quality problem; not the same as seeing a quality issue and now understanding that it's because of AI"
19,699b19eb2744be8e2c9e73ed,"I thought they felt like school projects for a grade. They didn't feel like real games from a developer wishing to publish them. So I guess knowing it's AI, is not too different from a student just wanting a passing grade.",no_effect,0,0,0,2,0,0,0,0,"""knowing it's AI, is not too different from a student just wanting a passing grade""",
29,5d1f5c20aaa27b001954de31,"yes, i could imagine the effort behind building a game from scratch and to programm it to be without errors so that was a bit of a disappointment. ",negative,0,0,0,2,0,0,0,0,,
12,697944af338eef9df5fe1845,"Yes, knowing that its AI makes it feel less genuine and less authentic",negative,0,0,2,0,0,0,0,0,,
17,669a65bbe45b41c3162d0d79,I would have probaly lowered my answers on the creativity or autenthicity scale ,negative,0,0,2,0,0,2,0,0,,
6,697a679cc7a5c19b7b777538,"no, i rated as it was, the first and second one were passable, the third was terrible. Ai cant know what is fun.",no_effect,0,1,0,0,0,2,0,0,"""Ai cant know what is fun"" --- ai lack understanding of human experience",
9,6980c16f9985e39f6bcbbe3a,"No, as the Ai isn't the one who came out with the idea. When I judged the games before I mainly judjed the concept behind the game. The mechanics and other game settings must have been reviewed by humans which also won't change the way I answered because that reflects what the developer wants and accepts to be published",no_effect,0,1,0,0,0,0,0,0,ai not viewed as developer; assumed human involvement in concept generation,
11,641359b5040c453203e2c088,"No, I don’t think I would have answered the previous questions differently. My ratings and explanations were based on my actual experience of the gameplay, mechanics, and design rather than who created the game. Even knowing the games were AI-generated, the enjoyment, creativity, originality, and sense of effort I perceived would remain the same because those assessments reflect how the game felt to play, not the developer’s identity.

",no_effect,0,1,0,0,0,0,0,0,,
15,6989cbe1ec0087fc9a540678,"Not really, it just looks pretty bad. Visuals and gameplay are pretty stale ",no_effect,0,1,0,0,0,0,0,0,,
16,6577257c0f74c02eed5453c8,"I thought that on the second game. It seemed generic. But my answers were about the gameplay, the originality, the ambient, the aesthetic. So, the experience in general was the thing that I evaluated. The last one was the only complex game, but everyone appeared to me like a mobile phone with a little time to enjoy it before quitting forever. I stand by my answers. ",no_effect,0,1,0,0,0,0,0,0,,
23,66b7c04e75051c539d8b4776,I wouldn't have answered differently since the questions were about the game and not about the creators as a whole.,no_effect,0,1,0,0,0,0,0,0,,
35,697a9cc58e44ed0a6d497a73,"No, I believe that regardless of who or what made the game, the ratings remain the same.",no_effect,0,1,0,0,0,0,0,0,,
36,69289ee670aad30bf97ccddf,"Nope, I consider the value of the game over the tools or methods used.",no_effect,0,1,0,0,0,0,0,0,tool,
37,69a07c9683353f56f4e8bc70,"No, my answers are based on the game, not the developer ",no_effect,0,1,0,0,0,0,0,0,,
38,5eee22ab319d6928d2ec1030,"No, because it doesn't matter who created it. The point was the games were fun to play and had some type of connection",no_effect,0,1,0,0,0,0,0,0,,
1,6983969b6ac55b26361bb853,"I would have answered the same questions. I felt from the beginning that there were strange things, and in the end, when she mentioned that it was B, I understood the reasons.",no_effect,0,0,0,0,0,0,0,0,,
10,698a1701a5b02ba695e33055,"No And i also knew from the beginning that they were made by ai it was very clear and obvious , only the 3rd game was decent even know i had the doubt that it was also made by ai",no_effect,1,0,0,0,0,0,0,0,,
27,6581c0e7703c9d00a5d2e6da,No I actually guessed that the first 2 games were made by ai considering how generic they were and I am not super shocked that the third one is ai as well,no_effect,1,0,0,0,0,2,0,0,,
3,698dfb569c22eca3eb8b65fa,"No, I felt like every of this game was vibe coded and it's ok.",no_effect,1,0,0,0,0,0,0,0,,
5,69346587dfdffc1057144d32,Not really I already had a feeling they were made with ai,no_effect,1,0,0,0,0,0,0,0,,
21,661db80bbbbc4861da7f75dd,"i genuinlly thought all these games had been coded using a.i this was going to be but in a finally thoughts if there was any chance to do so, just the whole way the game are and played in my experience i thought this was A.I  my answers i gave still stand ",no_effect,1,0,0,0,0,0,0,0,,
26,673e66683243bb7c85a17b5a,I wouldn't have answered any differently. ,no_effect,0,0,0,0,0,0,0,0,,
30,60c13bce0d8616e48d044bd0,"No. I still think the same way. I wouldn't change the concept of what I understand of creativity. Although it's true that AI, at least as far as I know today, isn't capable of generating new ideas, but rather of compiling and grouping them.",no_effect,0,0,0,0,0,2,0,0,,
31,60da6f47359a9fc411cc8313,I probably would not answer any questions differently.,no_effect,0,0,0,0,0,0,0,0,,
33,697b7d329eb08e3eb1ec8e2b,i wouldn´t change any answers but it looks like the AI it´s sometimes capable of making work of arts and sometimes it creates effortless stuff,no_effect,0,0,0,0,0,0,0,0,,didn't tag any themes because they're too mixed
34,6995128bd75ec09b6e8b6973,"no, other than with it being ai, i expect better now",no_effect,0,0,0,0,0,0,0,0,would've been more critical of game overall,
40,68d3f90c71dc2351e2b2d41e,"wow , i would have absolutely answered the questions entirely differently . the funny thing is after i finished the second game and i read the intention of the game , i said to myself this game had a concept only an AI could think of .",negative,0,0,0,0,0,0,0,0,,