row,prolific_subject_id,answer,valence,originality,overall_idea_concept,fun_engagement_challenging,visual,mechanics_gameplay,completeness_execution,design_intent,personal_invest_effort,accessibility,ai_gen,analytic_extra_note,analyst_defense
13,698dfb569c22eca3eb8b65fa,"When it comes to authetnticity I feel like I saw this game before, nothing special. About effort this game looks like vibe coded in 5 minutes.",unauthentic/intentional,2,0,0,0,0,2,0,2,0,2,,tagged ai because of vibe coding
19,6926452ca418f7b008a000a3,"This is a bit hard to answer since it's been revealed that the games have been developed by AI. Assuming there was a significant amount of human input though I feel like the idea behind the game could be authentic, but, like I mentioned before, it felt hardly playable. So in short; good idea but not very playable.",mixed,0,1,0,0,0,2,0,0,0,2,,didn't tag positive themes because the positive themes hinge upon significant human involvement
167,5b68c9eb87af310001584803,"this game felt like it was made by ai as it is very generic, had no story or theme and had little effort put into it as there are no clear instructions or options to go back to a menu to select levels, there is also no progression system or sense of reward which makes me think this was lazily made",unauthentic/intentional,0,0,2,0,0,2,2,2,2,2,no story/theme,
52,698a1701a5b02ba695e33055,"Didn't feel authentic at all, i felt like it was ai generated not human made.. also  i'm pretty sure any human wouldn't have an intent of making such game with all respect, it was like no effort was done what so ever.",unauthentic/intentional,2,0,0,0,0,0,2,2,0,2,,
53,698a1701a5b02ba695e33055,Not authentic at all or intentional cause it  seems like ai generated game with no purpose what so ever,unauthentic/intentional,2,0,0,0,0,0,2,2,0,2,"""no purpose""",
109,6111d08247ef6871bf11ec6b,"You said yourself it was made with AI. None of it is authentic, intentional or with effort.",unauthentic/intentional,0,0,0,0,0,0,2,2,0,2,,
127,698df101576c5053da213573,It's not authentic at all because I played that kind of game before. That's AI generated game so I guess not much effort and you can see it clearly.,unauthentic/intentional,2,0,0,0,0,0,0,2,2,2,,
160,6581c0e7703c9d00a5d2e6da,I think the game was just a blatant rip off of other games and there was barely no effort put it into it. I would not be shocked if AI made this game,unauthentic/intentional,2,0,0,0,0,0,0,2,,2,,
220,5a947fb0f05361000171b5a3,"I've seen similar gameplay mechanics in various mobile and flash games growing up. If the game was created by AI then I don't see the developer having put in much ""personal"" effort.",unauthentic/intentional,2,0,0,0,0,0,0,2,0,2,,
23,69346587dfdffc1057144d32,"It was authentich but I'm not sure about the efforts, it felt like cheaply made",mixed,1,0,0,0,0,2,0,0,0,1,,
22,69346587dfdffc1057144d32,"It was authentic because I have never played something like before, I didn't feel the reflection",authentic/intentional,1,0,0,0,0,0,0,2,0,1,,reflection is referring to the intentionality/effort rating question asking if the developer's personal intentions and efforts are reflected in the game
20,6926452ca418f7b008a000a3,The game idea isn't very original and I feel like the mechanics need a lot of extra fleshing out for it to be something truly enjoyable.,unauthentic/intentional,2,0,2,0,0,2,0,0,0,0,,
24,69346587dfdffc1057144d32,"cheaply made ""papers please"" copy",unauthentic/intentional,2,0,0,0,0,2,0,0,0,0,,
30,699c8b77fb904ad725023f28,"It's an idea that several games already use, the demo was really short and simple",unauthentic/intentional,2,0,0,0,0,2,0,0,0,0,,
59,697a65fa2b4f2c04ad2f3bc2,"Honestly the idea its just like the paper and the glider game. so i the first game was better but this game was worse than the other one. this was short and easy and literally whithout a menu or instruction. its was bad and unfunny but the idea can be more explore. the paperglider game, ",unauthentic/intentional,2,0,2,0,0,2,0,0,2,0,,
71,69139019e887fef6bf369ea3,"A simplistic cube jumping game is neither authentic, intentional, nor shows any real effort. I completed a single level and that was it. It never even explained any of the other mechanics of the game like what I was supposed to cut. 0/10 rating for this one sorry guys...",unauthentic/intentional,2,0,2,0,0,2,0,2,2,0,,
74,6989cbe1ec0087fc9a540678,It was nothing too special but it could be enjoyable in the future if it has a few features added. It looks like some existing mobile games,mixed,2,0,2,0,0,2,0,0,0,0,,could be fun but isn't currently
111,6111d08247ef6871bf11ec6b,"I know platformers are easy to make, but they aren't easy to make fun. This is prime example of that. The game is very barebones and underdevelopt for a platformer and really doesn't feel like it has anything that can distinguish it from the competition.",unauthentic/intentional,2,0,0,0,0,2,0,2,0,0,,
117,661db80bbbbc4861da7f75dd,played many like this could be better if physics improved feels rushed and unchecked,unauthentic/intentional,2,0,0,0,0,2,0,0,0,0,,didn't tag mechanics because they were really talking about completeness/execution of mechanics
144,697bacf779007fb89caad347,"The game isn't authentic because it doesn't really makes sense. It is not fun, in fact, it is stressful. In my opinion it is a quite bad game. It doesn't even feel like a real game. and I don't think the developer would have intended this. ",unauthentic/intentional,0,0,2,0,0,2,2,0,0,0,,
156,69781e065ba9a4f5f1743c76,just poorly made beat'em'up,unauthentic/intentional,2,0,0,0,0,2,0,0,0,0,,
215,698260ce3951fc5c27fc3dbc,"Honestly, I can't really call the game authentic because there just isn't enough content. It genuinely feels incomplete and needs to be finished. As for the dev, I think they could make something brilliant if they put some work into improving it. Right now, it's basically a 'blank canvas' with zero content. But I'm sure that with enough effort, it could turn into something great.",unauthentic/intentional,0,0,0,0,0,2,0,0,0,0,,
229,69967d911d9f679e547767a2,"The game visibly lacks creativity, and it shows; it is completely devoid of authenticity and passion. It is a real-time village protection simulation, but its execution is extremely basic. As I mentioned previously, I feel like I have played this exact type of game hundreds of times on old Flash platforms, which explains my low rating for authenticity.

Furthermore, it is obvious that the developers put very little attention and personal effort into the player's comfort and overall user experience (QoL), which justifies my low score on intentionality as well. It feels like a low-tier game that desperately needs improvements. While it is not the absolute bottom of the barrel in the gaming industry, it requires significantly more polish, refinement, and genuine heart",unauthentic/intentional,2,0,0,0,0,2,2,2,0,0,"""lacks passion"", needs more ""genuine heart"", but didn't say anything about ai and potentially even assumed the developers were human even though this person is in ai-aware condition",
232,66465c850d9a3e177f2649fa,"It feels like they just made the game in an hour just to see if they could. It didn't really have much thought put into it, so I don't think it had any form of authenticity or effort. It was lacking in mechanics and unique enemies that interacted with the player.",unauthentic/intentional,2,0,0,0,2,2,0,2,0,0,,
17,698efa571f78c2fb8bc759fc,"I think it's just a fun side project and not meant to be a full on game, but its a cool concept.",mixed,0,1,0,0,0,2,0,0,0,0,,
25,697a679cc7a5c19b7b777538,"Its a original idea, and the intention is good, but its really rough, need more polish.",mixed,1,0,0,0,0,2,1,0,0,0,,
28,699c8b77fb904ad725023f28,"The main mechanic/idea of this game is really unique but it needs a bit more work put into it, the game is at an extremely early stage, but once it gets polished, it's going to be really fun",mixed,1,0,0,0,0,2,0,0,0,0,,
58,697a65fa2b4f2c04ad2f3bc2,"I think it was an genuide idea or at least a good idea for a little game. and honestly a little intentionality because it was a good game but its was so green, like the triangle that can not go backwards, the game was easy and short. and i think maybe can be a good game but if the ai can explore more of this idea can be so much better.",mixed,0,1,0,0,0,2,0,0,0,0,,didn't tag ai because it seems like ai use is neutral here
66,61164e823465955346dc1827,could need some working in terms of reading speedi g but the concept from the basic stand view is great,mixed,0,1,0,0,0,2,0,0,0,0,,
67,67be6a20a52466ed9267d895,"It did feel like the game was designed to be difficult. I also think the idea behind it was original and had potential. However, it was a bit too challenging so I think the developer had good intentions but did not necessarily execute fully.",mixed,1,0,0,0,0,2,1,0,0,0,,didn't tag fun because it seems mixed
80,6980963784c580dd87bb1a3a,"The game felt genuine because it had a clear concept and consistent mechanics. The idea of changing object names showed intentional design. However, The execution was simple and minimal, so the overall effort felt moderate.",mixed,0,1,0,0,1,2,1,0,0,0,,
104,69348f64be85265e846c5117,"It is most likely to be authentic, what it is way too simple and abstract.",mixed,0,0,0,0,0,2,0,0,0,0,,hard to interpret; just tagged the theme that is clearly present
116,661db80bbbbc4861da7f75dd,theres a good base to something that needs work but its a good idea if there is more too it in terms of diffuculty,mixed,0,1,0,0,0,2,0,0,0,0,,
134,693cb7531c138f131ae16026,It is not a rip off of existing ideas as it's like a twin shooter but using rythm instead of using bullets . Intentionality is high and personal effort too as the music was enjoyable and the gameplay too. However it was a bit buggy,mixed,1,0,0,0,0,2,1,1,0,0,,
138,5c4684826a7dbc00017c0a87,"From what little I played, the core mechanic did have some authenticity to it, it felt like an interesting take. So the intentionality is there too, but in terms of effort it was too short ",mixed,0,1,0,0,0,2,1,0,0,0,,
142,697bacf779007fb89caad347,"The game felt authentic to me because I had never heard of a similar one before, and considering all the years I've spent playing different types of games, I think that's an important point to consider. However, I don't think the developer put that much effort into making the game, it feels somewhat empty. Although it does manage to vbe a little bit entertaining, I'm not sure how long I would play it. The game was't reflected in the game's design, starting with the menu, it was just simple text.  ",mixed,1,0,0,2,0,2,0,2,0,0,,didn't tag fun theme because it seems mixed 
151,6977c0dd24d3fdad12e17e23,"I feel there is authenticity, I don't feel like they stole ideas from other games, but they were ispired. the issue for me is that the time to think about the game itself was not enough; it seems a game made in a rush. the concept is a good start but it's too simple play a game like this... my biggest challenge was to understand what to do, not playing the game itself",mixed,1,0,0,0,0,2,0,0,2,0,,
209,66b93f99d7c07d8558f67c5c,"It was a relatively simple game, and the fact it wasn't properly recognising when I pushed space was an issue and shows that maybe it wasnt tested properly. In saying that, it was a good challenge and felt relatively authentic",mixed,0,0,1,0,2,2,0,0,0,0,,
231,69967d911d9f679e547767a2,"This game visibly demonstrates a bit more effort in its creativity and gameplay loop by attempting to vary the stages and objectives, which is a definite strength compared to the first two titles.

However, the extreme sluggishness, the poor visual clarity, and the unfairness of the second stage make the overall experience quite dreadful and highly unstimulating. This is exactly why I gave average ratings across the board. The game is slightly more original than the previous two, and one can sense a bit more personal effort put into the core mechanics, but ultimately, the execution remains extremely mediocre.",mixed,1,0,2,0,0,2,0,1,0,0,,mechanics were more about execution than the actual mechanic itself
234,66465c850d9a3e177f2649fa,"I think the developer tried to do something authentic and unique, but along the way they just decided to give up and make a game with an unfinished mechanic such as the movement. The movement was lacking in detail as it was hard to be accurate with it. The objects in the game, like what I believe were saw blades didn't harm the paper plane or anything else. I also fell down one of the gaps and I didn't get punished or game over from it. Overall the game feels like it had ideas at the start and the developer gave up half way through and just released it as is.",unauthentic/intentional,0,0,0,0,0,2,2,2,0,0,,
1,6983969b6ac55b26361bb853,"I'm frustrated; I can't even move anything without trying, and I don't see any effort being made.",unauthentic/intentional,0,0,2,0,0,2,0,2,0,0,,
21,6926452ca418f7b008a000a3,"Whilst there is a lot left to update in the game, I feel, I believe there was a solid idea behind this game which made it so that, in my opinion, this specific game felt the most like a complete 'game'. The execution and idea feels the most like a proper vision here.",authentic/intentional,0,1,0,0,0,2,1,0,0,0,,proper vision -> design intent
29,699c8b77fb904ad725023f28,"The core mechanics are great, they are very authentic, but it needs a bit more effort ",mixed,0,0,0,0,1,2,0,2,0,0,,
43,697d5e0f7563e62c0dddf2e7,Its possible to see that the developer had an idea for the game but just did not finiosh it or put effort on the asthetics,mixed,0,0,0,2,0,2,1,0,0,0,,
44,697d5e0f7563e62c0dddf2e7,Because the game did not work as intended and tha game was so basic it seems there was no effort.,unauthentic/intentional,0,0,2,0,0,2,0,2,0,0,,
46,6679a3b7cb020a6e4728eac5,"I think this game was a early prototype plataform game, it need more effort, and its taking shape. The actual game just include a brief tutorial, easy controls for movement and a objetive, i think if the objective of this project is learn about how make games it a pretty good beginning. The intention of this game is knowing that the player can learn how complete an objetive with just a few buttons and a exit box.",mixed,0,0,0,0,0,2,1,0,2,0,,
61,697944af338eef9df5fe1845,"I just think there isnt much too it, the idea is very basic it needs like a goal",unauthentic/intentional,0,2,0,0,0,2,2,0,0,0,"""needs like a goal"" lack of purpose",
68,67be6a20a52466ed9267d895,I felt like the developer intended for this game to run more smoothly and to made more sense than it did. I feel like they wanted the instructions to be more clear but they were not. It feels low effort and I also feel like they did not intend to make the game so confusing/hard.,unauthentic/intentional,0,0,0,0,0,2,0,2,2,0,,
70,69139019e887fef6bf369ea3,"It felt like a flash game that a kid in high school made from what brief parts I saw. Sorry but that is not a very impressive technical achievement. It was very simplistic, the controls didn't work, the game was unplayable due to the controls, so I can't give it much positive feedback sorry.",unauthentic/intentional,0,0,0,0,0,2,0,2,0,0,,
82,6577257c0f74c02eed5453c8,"It feels like a game from a JAM. Simple, with an appealing generic aesthetic and it can be done on one day with the knowledge and disposition. I did not see an intention, but maybe a short game to enjoy on free time can be an answer.",unauthentic/intentional,0,0,0,1,0,2,2,0,0,0,,
83,6577257c0f74c02eed5453c8,"This game reflects the visual taste of the author, but it was a low effort mechanics and level design. It feels like a practice test.",unauthentic/intentional,0,0,0,1,0,2,0,2,0,0,,
86,6987fbc16603cc742ebec4ec,it looked like a full game but when i played it it was only one level so i thought maybe i can restart the level but when i tried to i was sent here. the game is fun with a good intention of teaching the player how to think outside the box.maybe thinking of a new idea to the game. it will be a full game with a fun concept,mixed,0,0,1,0,0,2,1,0,0,0,,
91,698ce4c33956b8cb4fc8f802,"The game feels like a quickly made game, with no depth, no skill expression, and too shallow.
The game would need quite the amount of feedback to make it playable, as it is too buggy and lacks quality of life for a game.",unauthentic/intentional,0,0,2,0,2,2,0,2,0,0,,
101,699b19eb2744be8e2c9e73ed,It feels like a project for a class. It does not feel like the person behind it is trying to develop a real game.,unauthentic/intentional,0,0,0,0,0,2,0,2,0,0,,
108,6661e3435d2645ebabbb4c09,"I really wouldn't know how to describe this game I feel like it's missing something, as it feels a bit more subdued compared to the first two",unclear,0,0,0,0,0,2,0,0,0,0,,
115,661db80bbbbc4861da7f75dd,"not much effort was placed into this it was just a directed the flock here then to an end point, boring basic couldnt understand why my flock got smaller even after not hitting anything then lost control of everything when i had reached the end and would not register a completion ",unauthentic/intentional,0,0,2,0,0,2,0,2,0,0,,
128,698df101576c5053da213573,Very bad designed game. I didn't feel that authors put much effort in it.,unauthentic/intentional,0,0,0,0,0,2,0,2,0,0,,
130,66b7c04e75051c539d8b4776,The game presented technical issues.,unclear,0,0,0,0,0,2,0,0,0,0,,
146,631610af8e747093cd90e00d,"There's at least a kernel of potential in there, but it needs work to actually make it pop.",mixed,0,0,0,0,0,2,0,0,0,0,,
147,631610af8e747093cd90e00d,"While it was a bit janky, I can sort of see what the intentional was.",mixed,0,0,0,0,0,2,1,0,0,0,,
153,6977c0dd24d3fdad12e17e23,i feel like the developer didn't play their game before publishing. or that they didn't try to put themselves in the pov of the potential gamer,unauthentic/intentional,0,0,0,0,0,2,0,0,0,0,,
154,69781e065ba9a4f5f1743c76,"just everything i wrote previously, unplayable something without idea ",unauthentic/intentional,0,2,0,0,0,2,0,0,0,0,,
159,5ede88a1c008530fb60aa557,the game had potential but lacked effort,mixed,0,0,0,0,0,2,0,2,0,0,,
162,6581c0e7703c9d00a5d2e6da,This game had a cool theme and story behind it I do think there was some genuine effort behind it. I just think the gameplay itself needs some improvement it was more frustrating than fun at some parts,mixed,0,2,0,0,,2,1,1,0,0,,
175,699f6b2ff9170ee287ce9161,"It's a game with simple mechanics, but they could be polished. If the intention was to offer an idea, it could have a future with better development.",mixed,0,0,0,0,2,2,0,0,0,0,,
183,60da6f47359a9fc411cc8313,The game had an unfinished feel like it was missing a majority of it,unauthentic/intentional,0,0,0,0,0,2,0,0,0,0,,
185,697cee693cacc7fc3ccaedb3,"This game had much more effort put on it, the design was very cool but the game its to basic right now, but the concept of the game is cool and with some improvements it has some potencial.",mixed,0,1,0,,0,2,0,0,0,0,,
186,697cee693cacc7fc3ccaedb3,"The game didnt had any effort put it on, mechanics didnt work, no tutorial but the intentionality of the author was there.",mixed,0,0,0,0,0,2,1,2,2,0,,
226,66d0944b9f8f566817ad708c,"Authenticity like I said it if I had more time to read about the rules of the game i would have felt different, the intentionality also was fair, effort on the game feels like the programmer just started coding and this was their first coding project",mixed,0,0,0,0,0,2,1,2,2,0,ai not viewed as developer,
227,66d0944b9f8f566817ad708c,"authenticity is fairly contsructive, and intentionality is pretty clear but effort is low nothing pretty interesting has been displayed, like I said no obstructions",mixed,0,0,0,0,0,2,1,2,0,0,,
236,696aa41c3b8c0f122470a488,It barely worked which is why it did not feel authentic or seemed like any effort was put into it.,unauthentic/intentional,0,0,0,0,0,2,0,2,0,0,,
239,68d3f90c71dc2351e2b2d41e,"there was some effort that was put into this game , but i don't think that its ready to be played , i could only guess from the visuals that the game is about golf.  ",mixed,0,0,0,0,0,2,0,0,0,0,,
6,677948fa843635fdb42a4351,"authenticity: The setting was unique, even though it reminds me of playing mobile games I cant seem to to remember specifically what games it reminds me off.
 intentionality, and effort: The limitations of the character I was playing made me really think the game was perfectly tuned and play tested before hand.",authentic/intentional,1,0,0,0,1,1,0,0,0,0,,
47,6679a3b7cb020a6e4728eac5,"I think this game was authentic, i have played many rythm games and this concept was pretty original, the intention of the game was capturing those enemies (even if the game call them thieft o something like that for the player is like killing enemies that make sounds). The effort to create different patterns for the enemies are good, there are a main menu, with the lore and controls of the game, and then a scene with 4 different enemies.",authentic/intentional,1,1,0,1,0,1,1,1,0,0,,
60,697a65fa2b4f2c04ad2f3bc2,"Honestly for an Ai work its was good, diferent 7 levels, good idea, hard parts, the light and dark switch idea, and the idea of lose with if the dark gets you so you can actually lose, its was fine and original, also, each level had their own phrase so that make gain more on intentionality and authenticity, because its was like a poem, especially in the end, and that make a touch and feels like you are just not playing like a game with jumps and hard levels its was also about an history behing that, and that make you feel more in to the game. that why i choose 5 in all.",authentic/intentional,1,1,1,0,1,1,1,0,0,0,"purpose/""poem"" ""feel more into the game"" -- seems they felt the emotional resonance ","tagged 1 for ai_gen because it seems like the person lowered their expectations since they knew it was ai ('for an ai work it was good'), in turn leading to a more positive rating than they would've given had they not known ai made the game"
150,6992fdf8bd688e6c9f7627b8,"It felt like an authentic concept with a basic framework. The smoothness of the gameplay shows the dev put personal effort into polishing the game. Especially because of the cube having bounce physics. Everything that happened in this game felt like it was intentional, just could've used a little more explanation.",authentic/intentional,0,1,0,0,1,1,1,1,2,0,,
55,641359b5040c453203e2c088,"Authenticity. The game felt authentic because the wind mechanics and plane movement behaved in a believable and consistent way. The reactions to changes in airflow made sense and added to the realism of guiding a paper plane rather than feeling random or artificial.

Intentionality. The design choices seemed purposeful especially in how the wind influenced direction and difficulty. The obstacles and increasing challenge felt planned to test skill progression instead of being placed randomly.

Effort. It was clear that effort was put into the functionality and responsiveness of the controls. The smooth movement and interactive wind system showed attention to detail even if some areas like sensitivity balancing could be improved slightly.",authentic/intentional,0,0,1,0,1,1,1,1,0,0,,
72,69139019e887fef6bf369ea3,"It felt like this one actually had a good idea behind it and was built out into a proper game. Rather than immediately redirecting me, or crashing out, the controls all worked, and the game was playable to the end. I enjoyed this one much more for the effort put into it.",authentic/intentional,0,1,0,0,0,1,1,1,0,0,,
148,6992fdf8bd688e6c9f7627b8,"It feels like a simple, but well executed game. Though simple, the controls work well and the movement is smooth and polished. For the same reasons it feels like there was personal effort put in to make it function as well as it does. ",authentic/intentional,0,0,0,0,0,1,0,1,0,0,,
12,5d164f9b1a4be700176367bd,I think i saw this type of game 100 times already. It reflected the developer's lazy mindset.,unauthentic/intentional,2,0,0,0,0,0,0,2,0,0,,
32,6989c0c01b2e93d5d8f2e20a,"the core game idea wasnt much authentic as it was made alot in various types of games. the developers intentions of making a fun, challenging game were really on point and he did great effort in the concept but aesthatic and core concept wise, there wasnt much effort",mixed,2,0,1,2,0,0,,1,0,0,assumed human developer (ai-blind),
40,6501b789e3ddbc0a0b79b925,"The game did not feel super authentic, as it felt like a different version of Pac-Man. It was ripping off the idea. The intentionality and effort were adequate, as some effort went into the game, and there was some clear differentiation with the addition of the relic, but not enough to make it super inspiring. ",mixed,2,0,0,0,0,0,1,1,0,0,,
49,6980c16f9985e39f6bcbbe3a,As I mentioned before the game's concept has been made before so many times. Not onlt the concept but I think the exact game is found somewhere.  Nothing is new to attract new users to this game. The developer simply copied the game with little or no effort,unauthentic/intentional,2,0,0,0,0,0,0,2,0,0,,
69,67be6a20a52466ed9267d895,"The game felt unoriginal and like a copy of other simple games I have seen. Also, there was no original aspect in terms of the blocks/walls themselves so this shows me a lack of effort.",unauthentic/intentional,2,0,0,0,0,0,0,2,0,0,,
75,6989cbe1ec0087fc9a540678,"It is also a game coded in 1 hour at best, bad gameplay, bad visuals. Looked like any 2d game from 90's",unauthentic/intentional,2,0,0,2,2,0,0,2,0,0,,
