row,prolific_subject_id,answer,valence,originality,overall_idea_concept,fun_engagement_challenging,visual,mechanics_gameplay,completeness_execution,design_intent,personal_invest_effort,accessibility,ai_gen,analytic_extra_note,analyst_defense
188,697b7d329eb08e3eb1ec8e2b,"It´s an original idea definitely, but it´s not for everyone. maybe it has benefics for the brain development in children. To me it seems that the developer put a lot of effort to create this game because i had never seen something like that.",authentic/intentional,1,0,0,0,0,0,0,1,0,0,,
190,671a6c6227da7c097cfe8caf,"Extremely authentic but for the developers effort i dont think they put too much in it 
",mixed,0,0,0,0,0,0,0,2,0,0,,
192,671a6c6227da7c097cfe8caf,It was authentic indeed,authentic/intentional,0,0,0,0,0,0,0,0,0,0,,
195,6995128bd75ec09b6e8b6973,it was a good game. good idea for the music genre,authentic/intentional,0,1,0,0,0,0,0,0,0,0,,
196,68c03814183fb278ae8ac1c9,"the game's idea is authentic and original. Although the game is 2d but it felt like there was a big effort in the game development because of the animations, the sound effects, and the creature interactive responses",authentic/intentional,1,0,0,1,0,0,0,1,0,0,,
198,68c03814183fb278ae8ac1c9,the idea is authentic and the developer seems to have done a big effort to produce this game because of its novel idea and visual effects,authentic/intentional,1,0,0,1,0,0,0,1,0,0,,
205,69129a44e90ae61a87c472fd,"The game is authentic, although many games (especially older ones) use the same mechanics and style of play. I believe that the game was created by its creator to be exactly that way, demonstrating his intention and effort.",authentic/intentional,0,0,0,0,0,0,1,1,0,0,,"didn't tag originality because it seems like the fact that it wasn't original is what contributed to authenticity/intention. this participant one of two people who communicated this idea, so i don't think this is common enough to be worth creating a theme for."
206,69129a44e90ae61a87c472fd,"Classic game model, widely used style, but the creator managed to add his own touch to this game, making it quite authentic, even though there are many others of the same style.",authentic/intentional,0,0,0,0,0,0,0,0,0,0,,"didn't tag originality because it seems like the fact that it wasn't original is what contributed to authenticity/intention. this participant one of two people who communicated this idea, so i don't think this is common enough to be worth creating a theme for."
207,69129a44e90ae61a87c472fd,"The creator's intention seems quite clear and is reflected in the game. The game has its own way of being authentic, although it is important to note that the game style is classic and widely used.",authentic/intentional,0,0,0,0,0,0,1,0,0,0,,unclear what themes are present
212,69a07c9683353f56f4e8bc70,"4 is my rating of authenticity because I never played or seen anything similar
3 is my rating of intentionality and personal effort cuz the robe color changing and the vibration made the game more engaging ",authentic/intentional,1,0,0,0,1,0,0,0,0,0,,
214,698260ce3951fc5c27fc3dbc,"Like I said earlier, the game is cool and definitely has its own vibe. The gameplay, aesthetics, and premise are all solid, but I wouldn't call it groundbreaking.",mixed,2,1,0,1,1,0,0,0,0,0,,
216,698260ce3951fc5c27fc3dbc,"Overall, I absolutely loved the gameplay. I found it really fun, and I think these features make the game feel authentic. It definitely shows that a lot of effort went into making it play so well.",authentic/intentional,0,0,0,0,1,0,0,1,0,0,,
217,5eee22ab319d6928d2ec1030,"The game felt genuine, I felt the love that was put into making it. That also includes with the intentionality and effort of creating the game.",authentic/intentional,0,0,0,0,0,0,1,1,0,0,,
218,5eee22ab319d6928d2ec1030,"It felt authentic and genuine, because they put a little twist to the game.",authentic/intentional,1,0,0,0,0,0,0,1,0,0,,
221,5a947fb0f05361000171b5a3,"I've seen the idea executed once before in a much better way, but this idea is still unique, and I think it reflected the intentionality of the developer well.",mixed,1,0,0,0,0,0,1,0,0,0,,
222,5a947fb0f05361000171b5a3,"The game does feel like a slight knock-off of other similar games in the genre, but the flavor of it was unique and felt like it reflected the intentionality well. But the shoddy mechanics and things of that nature didn't match effort-wise.",mixed,1,0,0,0,2,0,1,2,0,0,,
224,6980e32bc22bae8cb57154ed,"the developer may have based this game on some existing ideas, but it does not seem like a rip off, i like that the developer thought of not showing the whole way, and if the developer meant including invisible obstacles then i like their personal effort, if not then when you think about it, it could be a lack of effort in developing ",mixed,0,1,0,0,0,0,1,0,0,0,,originality seems mixed
233,66465c850d9a3e177f2649fa,"The game feels authentic in being unique and trying to do something different compared to most games. The developer intentionally tried to make a game that stood out with a unique mechanic and see how people could adapt to the concept. The effort went into the mechanics of the game rather than the visual design, which I could definitely appreciate.",authentic/intentional,1,0,0,2,0,0,1,1,0,0,,
240,68d3f90c71dc2351e2b2d41e,"this one by far is the most game that i felt like more effort was put into it , and the concept of the game is very unique .",authentic/intentional,1,0,0,0,0,0,0,1,0,0,,
241,698df8c121a05e20db810262,Seems to me like someone tried to make a new spin on a well known type of the game. Seems to me like it's someone's project intentionaly made to be something new and entertaining,authentic/intentional,1,0,1,0,0,0,1,0,0,0,,
3,6983969b6ac55b26361bb853,It was unpleasant; I felt bored and wished the game would end.,unauthentic/intentional,0,0,2,0,0,0,0,0,0,0,,
4,677948fa843635fdb42a4351,"I gave a 4 for the authentic rating feel as I feel as if the game is designed for people who are musically inclined as a lot of the game just seemed overly complicated, especially with the designs of the circles.
I rated intentionality and effort as a 5. There definitely is an intention to the game as I feel as if the games design and especially sound design is purposefully quiet and lo-fi like in order to suck you into the game.  I can only imagine the developer put a lot of effort into the game, the art style was cool and futuristic.
",authentic/intentional,0,0,0,1,0,0,1,1,2,0,,
7,5cd0909f6e2d5800163ed5de,that game sucked and was not good at all,unauthentic/intentional,0,0,2,0,0,0,0,0,0,0,,
9,5cd0909f6e2d5800163ed5de,going to the light brung me idea of some insect in real life,unclear,0,1,0,0,0,0,0,0,0,0,,
11,5d164f9b1a4be700176367bd,I think the game reflected the developer's lazy mindset.,unauthentic/intentional,0,0,0,0,0,0,0,2,0,0,,
18,698efa571f78c2fb8bc759fc,"Game had black color and it looked very, empty and soulless",unauthentic/intentional,0,0,0,2,0,0,0,2,0,0,"""soulless"" - ai blind",
36,59f8868e05d1d60001f1464d,This is a poor effort.  First two games were good.,unauthentic/intentional,0,0,0,0,0,0,0,2,0,0,,
37,670ff2e18c2f93beac6a6a72,I would say it is pretty good for this setting. I mean it was used for science so that makes it a little better.,unclear,0,0,0,0,0,0,0,0,0,0,,
38,670ff2e18c2f93beac6a6a72,The controls and gameplay felt messy. Not sure what the premise was for.,unauthentic/intentional,0,0,0,0,2,0,2,0,2,0,,
45,697d5e0f7563e62c0dddf2e7,"The game reflected what the developer intended from what i could see, just was not looking very good.",mixed,0,0,0,2,0,0,1,0,0,0,,
65,61164e823465955346dc1827,soleley because i was confused,unclear,0,0,0,0,0,0,0,0,2,0,,
73,6989cbe1ec0087fc9a540678,"This looks like a game coded in 1 hour it poor visuals, mechanics and gameplay overall",unauthentic/intentional,0,0,0,2,2,0,0,2,0,0,,
77,697fa6c649bf75696f73c7c0,"The game is genuine, and it shows a personal effort to demonstrate that in life we ​​can walk a straight line and not fall into the void.",authentic/intentional,0,1,0,0,0,0,1,1,0,0,emotional resonant theme ,
79,6980963784c580dd87bb1a3a,"The game felt intentional in its design, especially in how the dependency mechanic influenced the ending.",authentic/intentional,0,0,0,0,1,0,1,0,0,0,,
81,6980963784c580dd87bb1a3a,The design showed clear thought and thematic consistency.,authentic/intentional,0,1,0,0,0,0,1,0,0,0,theme,
92,698ce4c33956b8cb4fc8f802,"The game was boring and uninspired, the game doesn't reflect the developer intentionality of saving people.",unauthentic/intentional,0,0,2,0,0,0,2,2,0,0,,
100,699b19eb2744be8e2c9e73ed,"The instructions need a lot more effort. It needs to be cleared at the start, which piece is the one the player is supposed to be moving. And the game does not feel intentional at all. I completed without thinking. It felt random when the piece advanced, and when it didn't.",unauthentic/intentional,0,0,0,0,2,0,2,0,2,0,"""felt random"" - ai blind",
106,6661e3435d2645ebabbb4c09,"It's actually a bit complicated to describe the game since the mechanics and goal were simple, however you can see the intentions and effort behind the game",authentic/intentional,0,0,2,0,0,0,1,1,0,0,,tagged fun because the said game was simple and it seems like this was a negative thing
107,6661e3435d2645ebabbb4c09,It's clear that it's a project made with care and dedication it was entertaining to play,authentic/intentional,0,0,1,0,0,0,0,1,0,0,,
110,6111d08247ef6871bf11ec6b,"I felt like I played something similar before, but I can't say exactly what and I don't feel like it was common. It also seems aimed at a very specfic crowd, which means it has some intentionallity. ",mixed,0,0,0,0,0,0,1,0,0,0,,
113,6989da604f75e4c44ffefa17,i liked the idea and the effort shown is great but it was also a bit frustrating had to do it a lot of times to understand and to read and remeber the steps needed,mixed,0,1,0,0,0,0,0,1,2,0,,
129,698df101576c5053da213573,Light mechanics was great. I felt like someone put a little effort in it.,authentic/intentional,0,0,0,0,0,0,0,1,0,0,,
145,631610af8e747093cd90e00d,There was nothing about the game that really shouted intentionality. The experience was hollow.,unauthentic/intentional,0,0,0,0,0,0,2,2,0,0,"""game experience was hollow"" - ai aware",
152,6977c0dd24d3fdad12e17e23,"I missed the 'gaming' factor, it seemed like a thing a developer does in their spare time",unauthentic/intentional,0,0,0,0,0,0,0,0,0,0,,unclear what they're saying
157,5ede88a1c008530fb60aa557,it shows no one put any effort into this game,unauthentic/intentional,0,0,0,0,0,0,0,2,0,0,,
158,5ede88a1c008530fb60aa557,That was definitely made to annoy someone,unclear,0,0,2,0,0,0,0,0,0,0,,
163,6941c8bfb62e4a8cb89c8925,"I mean it looks pretty artistic and the music and beat is here so i believe that the author is a creative-art guy, i believe he did his best",authentic/intentional,0,0,0,1,1,0,0,1,0,0,,
165,6941c8bfb62e4a8cb89c8925,"this game was alright, not my type, but alright",unclear,0,0,0,0,0,0,0,0,0,0,,
166,5b68c9eb87af310001584803,i believe this game was created with intent and a great deal of effort as the art and design of the game looked good and the rules of the game felt like they had a human touch to them as it seems familiar with games I've played before,authentic/intentional,0,0,0,1,0,0,1,1,0,0,,"didn't tag originality because it seems like the fact that it wasn't original is what contributed to authenticity/intention. this participant one of two people who communicated this idea, so i don't think this is common enough to be worth creating a theme for."
168,5b68c9eb87af310001584803,"i felt like some thought and effort was put into this as there is a puzzle to solve on each level that with enough concentration can be solved, the art design was lacking a bit and same with the instructions but the overall functionality was good and i can imagine each level having a harder puzzle which makes me think that effort was put into this.",mixed,0,0,1,2,1,0,0,1,2,0,,
181,60da6f47359a9fc411cc8313,"I feel like the game could've been much better if more time was put into it, especially in the art section",unauthentic/intentional,0,0,0,2,0,0,0,2,0,0,,
191,671a6c6227da7c097cfe8caf,Not as great as the previous game,unclear,0,0,0,0,0,0,0,0,0,0,,
193,6995128bd75ec09b6e8b6973,"it could be they purposely created the game like that. to me, felt like they didnt even try",unauthentic/intentional,0,0,0,0,0,0,0,2,0,0,,
194,6995128bd75ec09b6e8b6973,i truly enjoyed it. its definitely something i would play again,authentic/intentional,0,0,1,0,0,0,0,0,0,0,,
197,68c03814183fb278ae8ac1c9,the game felt that it had no effort exerted on it as it lacked visual effects and sound effects that make the game feels more enjoyable,unauthentic/intentional,0,0,0,2,0,0,0,2,0,0,,
199,697a9cc58e44ed0a6d497a73,"The premise is quite different, but the design and style of the components are very reminiscent of other games. It's quite fun, it just needs to be a little more consistent with the standards.",mixed,2,0,1,0,0,0,0,0,0,0,,
200,697a9cc58e44ed0a6d497a73,"The two-handed controls felt very authentic, which is great.",authentic/intentional,0,0,0,0,1,0,0,0,0,0,,
203,69289ee670aad30bf97ccddf,"The game felt very genuine, and with mindful effort put into it, te game was challenging in a way yet not limited in a way that the player would get frustrated, which shows good intentionality.",authentic/intentional,0,0,1,0,0,0,1,1,0,0,,
210,66b93f99d7c07d8558f67c5c,Yes i believe there effort and intentionality was there for this game as it was difficult and had lots of different moving parts you had to consider,authentic/intentional,0,0,1,0,0,0,1,1,0,0,,
219,5eee22ab319d6928d2ec1030,I could feel the creator put their heart into making an immersive game.,authentic/intentional,0,0,0,0,0,0,0,1,0,0,,
225,6980e32bc22bae8cb57154ed,"i think the developer didnt even try on this one, i dont like it, no instructions, no fun and no clear goal",unauthentic/intentional,0,0,2,0,0,0,2,2,2,0,"""no clear goal"" / no purpose",
228,66d0944b9f8f566817ad708c,"not much i can say but this game was fun, apprecite the effort and the intentionality was pretty clear ",authentic/intentional,0,0,1,0,0,0,1,1,0,0,,
235,696aa41c3b8c0f122470a488,I think it's a pretty bad game and it shows the developer's effort.,unauthentic/intentional,0,0,0,0,0,0,0,2,0,0,,
237,696aa41c3b8c0f122470a488,I felt like I did the same jump for most of the game.,unauthentic/intentional,0,0,2,0,2,0,0,0,0,0,,
242,698df8c121a05e20db810262,"I belive there is a story being told there, something personal and real.",authentic/intentional,0,0,0,0,0,0,1,1,0,0,person felt emotional resonance - ai blind,