row,prolific_subject_id,answer,valence,originality,overall_idea_concept,fun_engagement_challenging,visual,mechanics_gameplay,completeness_execution,design_intent,personal_invest_effort,accessibility,ai_gen,analytic_extra_note,analyst_defense
87,6987fbc16603cc742ebec4ec,this game looked like it was made by a greedy company the concept is copied the game play is the same as different game. yeah it has a changed prospective but it looked the same to me,unauthentic/intentional,2,0,0,0,0,0,0,2,0,0,,
93,698ce4c33956b8cb4fc8f802,"The game feels unaunthentic, as it ripoffs many old games that are like this, but the animation at the ending, relfects a little about the intentionality of the developer.",mixed,2,0,0,0,0,0,1,0,0,0,,
99,5e1b3b93f07b72359c0c4ffe,don't see much effort and originality,unauthentic/intentional,2,0,0,0,0,0,0,2,0,0,,
103,69348f64be85265e846c5117,"do not feel really authentic, or say there is pretty much game that is similar.",unauthentic/intentional,2,0,0,0,0,0,0,0,0,0,,
112,6989da604f75e4c44ffefa17,probably a mix of flappy birds and IO games i think i played before the effort is to be honest feel  just slapping some blocks with terrible colors and think the user should know how to pass through,unauthentic/intentional,2,0,0,2,0,0,0,2,2,0,,
122,566bdeb3beaf21001240085a,"As I mentioned, I've seen this game so many times I'm sure everyone knows one or another version, so I don't think there's anything authentic. What I'm not sure, however, is how the developer imagined this, maybe it's not their fault and the AI made it super basic (in other words, there can be a game with a known mechanic that is original and good, but this is the most basic version of this kind of game).",unauthentic/intentional,2,0,0,0,0,0,0,2,0,0,,
123,566bdeb3beaf21001240085a,"This is just the same game of always, there's no way the prompter didn't know what they were doing.",unauthentic/intentional,2,0,0,0,0,0,0,0,0,0,,
125,697d2057698dc9f0b71f0a43,"I don't think the developer put in any effort, and the game wasn't authentic at all; it simply copied one of the thousands of games that have the same mechanics. It seems very much like a copy of a game that already has these ideas.",unauthentic/intentional,2,0,0,0,0,0,0,2,0,0,,
131,66b7c04e75051c539d8b4776,It's not a game that stands out or is particularly original. The designs aren't very original.,unauthentic/intentional,2,0,0,2,0,0,0,0,0,0,,
132,66b7c04e75051c539d8b4776,"Although it seems like a pretty interesting game, it doesn't feel entirely authentic to me. Even so, it has some enjoyable mechanics.",mixed,2,0,0,0,1,0,0,0,0,0,,
135,693cb7531c138f131ae16026,It is a basic platformer so it's not a rip off but it is just like other games of this genre. There was not much effort involved in the creation of this game,unauthentic/intentional,2,0,0,0,0,0,0,2,0,0,,
137,5c4684826a7dbc00017c0a87,"I think the intentionality and effort for this is moderate, because it isn't doing anything unexpected or surprising overall. I found it not too authentic as the core mechanics aren't groundbreaking",unauthentic/intentional,2,0,0,0,0,0,0,0,0,0,,
139,673e66683243bb7c85a17b5a,"I don't think the developer put any real effort in the game, because it indeed felt like a rip-off of other existing browser games, which i think the developer wouldn't put any genuine effort in.",unauthentic/intentional,2,0,0,0,0,0,0,2,0,0,,
141,673e66683243bb7c85a17b5a,"I do think there was some work put into this game, but it doesn't feel that original that i would say the developer was being genuine.",mixed,2,0,0,0,0,0,0,0,0,0,,
149,6992fdf8bd688e6c9f7627b8,"It was a mildly interesting idea, mostly because of the tether. Other than that there seemed to be little originality in the concept or level design. This also reflects to me that there was little personal effort put into this game as the level looks boring and the gameplay is quite bland.",mixed,2,0,2,2,0,0,0,2,0,0,,
161,6581c0e7703c9d00a5d2e6da,I think there are too many games like this out there already. The controls were good and had some effort put into it other than that just a generic game,mixed,2,0,0,0,1,0,0,1,0,0,,
164,6941c8bfb62e4a8cb89c8925,it was just a basic common game really,unauthentic/intentional,2,0,0,0,0,0,0,0,0,0,,
173,5d1f5c20aaa27b001954de31,it wasnt that unique of an idea but the game was enjoyable and had its own standing and effort.,mixed,2,0,1,0,0,0,0,1,0,0,,
184,697cee693cacc7fc3ccaedb3,The game is very basic so I dont think it got put to much effort on the game or even on the code. The game its similar to some other older games.,unauthentic/intentional,2,0,0,0,0,0,0,2,0,0,,
187,697b7d329eb08e3eb1ec8e2b,I rate low authenticity because the game looks and feels like other games i had played before. Maybe the developer has intentionality about that kind of game but i lacks more effort cleaning the bugs and put more animations an mechanics to appeal more people interested in this kind of games.,unauthentic/intentional,2,0,0,0,2,0,1,2,0,0,,
189,697b7d329eb08e3eb1ec8e2b,it isn´t original at all and i don´t think the developer put much effort in the creation of this game. I hope there is something behind it that i couldn´t get it but that is how i perceive it,unauthentic/intentional,2,0,0,0,0,0,0,2,0,0,,
201,697a9cc58e44ed0a6d497a73,"The game lacked authenticity, resembling other games but only intentionally avoiding documentation. It was a well-executed piece of work, but there's still room for improvement.",mixed,2,0,0,0,0,0,0,0,2,0,,
202,69289ee670aad30bf97ccddf,"On the matter of authenticity, the game does not bring any new idea as far as I was able to play it, so it was average in my honest opinion. About the intentionality and effort, it is pretty much seen that the developer did think up some ideas and tested them out.",mixed,2,0,0,0,0,0,1,1,0,0, ,slightly confusing/ hard to interpret. tagged themes that seemed most present; avoided speculation
204,69289ee670aad30bf97ccddf,"The idea has been so much used since the days of magic and might, so I don't think there is much genuineness. Also, the game doesn't have much to do in it except for spam-click, as there is no real strategy, meaning not enough effort and intention were put into it.",unauthentic/intentional,2,0,2,0,2,0,2,2,0,0,,
208,66b93f99d7c07d8558f67c5c,"Getting something from A to B is not original, and the ""cut space"" gimmick wasn't really enjoyable, and didnt really show much in the way of effort. ",unauthentic/intentional,2,0,2,0,0,0,0,2,0,0,,
211,69a07c9683353f56f4e8bc70,"i rated the authenticity 2 cuz i feel that i played a similar game before 
3 for the intentionality and effort, cuz its made out of simple mechanics and graphics ",unauthentic/intentional,2,0,0,2,0,0,0,0,0,0,,
213,69a07c9683353f56f4e8bc70,"1 in authenticity cuz ive seen a lot of games like this one
3  in intentionality, and effort, cuz i feel that the developer put some effort into this game",mixed,2,0,0,0,0,0,0,1,0,0,,
223,6980e32bc22bae8cb57154ed,"as i said in the previous questions' answers, it felt like some old retro games that i have played in my childhood on my old pc, with basic goals such as clicking or moving with keyboard to protect people or a princess, so its not authentic, and it feels like the developer didnt put much effort into making it.",unauthentic/intentional,2,0,0,0,0,0,0,2,0,0,,
230,69967d911d9f679e547767a2,"Overall, the game feels heavily recycled. In old-school stealth games, there were already countless mechanics exactly like this where the sole objective was to avoid the light and move from point A to point B.

The experience is highly unstimulating because it gives off a very basic 'Flash game' vibe. Consequently, it completely fails to reflect any genuine developer intentionality or a sincere effort to create an appealing game. Due to the overall poor quality and the extreme shallowness of the gameplay loop, it feels lifeless. Ultimately, the only concept genuinely worth keeping and expanding upon is the mechanic of dying if you stay in the darkness for too long",unauthentic/intentional,2,0,2,0,0,0,2,2,0,0,,
238,68d3f90c71dc2351e2b2d41e,"as i said before the overall concept of the game is kind of similar to other games , but the personal effort of the developer is very obvious in the details of the game .",mixed,2,0,0,0,0,0,0,1,0,0,details show effort,
243,698df8c121a05e20db810262,I feel like it was probably a lot od effort to code a game like that.There was surely an idea behind it but for me it's not really a new or creative concept.,mixed,2,0,0,0,0,0,0,1,0,0,,
2,6983969b6ac55b26361bb853,"It has some new ideas, but it's a bit boring and slow, and seems somewhat mysterious.",mixed,1,0,2,0,2,0,0,0,0,0,,
5,677948fa843635fdb42a4351,"authenticity: It plays like a lot of other stealth games, I don't think it is fair to call it a rip off though, it had quite a few unique features and the down to earth visuals really give an authentic indie feel to the game.
intentionality, and effort: the outlay of the puzzle I feel was very intentional, the developer obviously knows how to create tension in a video game and I don't think its possible to do that by accident or without a lot of effort.",authentic/intentional,1,0,0,1,0,0,1,1,0,0,"""the developer obviously knows how to create tension in a video game""","original was mixed; checked this person's ratings of authenticity and they were all 4s and 5s, so seems that the positive of originality outweighed the negative, hence tag of 1"
8,5cd0909f6e2d5800163ed5de,I havent heard of similiar game with changing objects names,authentic/intentional,1,0,0,0,0,0,0,0,0,0,,
10,5d164f9b1a4be700176367bd,I think the developer really made an effort to make an original and authentic game not just a copy of another game.,authentic/intentional,1,0,0,0,0,0,0,1,0,0,,
14,698dfb569c22eca3eb8b65fa,"I feel it's authentic because this game mechanics are for me something new. When it comes to developers effort I give 3 for game idea, but I don't really like 2D games with graphics like that, so the dev doesn't really put the effort into graphics.",mixed,1,1,0,2,0,0,0,0,0,0,,
15,698dfb569c22eca3eb8b65fa,"This game was extremely authentic because this game mechanic was something new and it was a brilliant idea. When it comes to effort, I think the dev put a lot of effort to get the idea for game mechanics. The graphics are also okay, I think that's how the game should be looking to have this atmosphere.",authentic/intentional,1,0,0,1,0,0,0,1,0,0,,
16,698efa571f78c2fb8bc759fc,It looks like the developer put his heart and time in it to make something that no one ever tried to make before,authentic/intentional,1,0,0,0,0,0,0,1,0,0,,
26,697a679cc7a5c19b7b777538,"its a cool game that do its own thing, while having good gameplay and fun challenge.",authentic/intentional,1,0,1,0,1,0,0,0,0,0,,
27,697a679cc7a5c19b7b777538,"The game idea was good, the gameplay was terrible",mixed,0,1,0,0,2,0,0,0,0,0,,
31,6989c0c01b2e93d5d8f2e20a,from the authenticity point of view the game wasnt kinda authentic as the visuals were a bit cheap and kinda looked like another game which is geometry dash regardless of the creative and new play style. i think the developer intended to make a new-playstyle game but didnt pay much effort in the aesthetics but nonetheless he did a great effort creating a new mechanic for the game and it was pretty interesting,mixed,1,0,0,2,0,0,1,1,0,0,ai not viewed as developer,
33,6989c0c01b2e93d5d8f2e20a,the developer really did a great job and effort coming up with this new concept and mechanic of the game so in my opinion the idea of the game was really authentic and the intentions of the developer of making a fun and  creative game that depends on a truly new concept was really reflected through the game,authentic/intentional,1,0,1,0,0,0,1,1,0,0,,
34,59f8868e05d1d60001f1464d,Ive never seen anything like it before,authentic/intentional,1,0,0,0,0,0,0,0,0,0,,
35,59f8868e05d1d60001f1464d,Felt genuine as not played a game similar to it before,authentic/intentional,1,0,0,0,0,0,0,0,0,0,,
39,670ff2e18c2f93beac6a6a72,It might have required little effort but it was very creative. Not sure if that was intentional but whoever made that game is creative.,mixed,0,0,0,0,0,0,0,0,0,0,,"this participant was in ai aware condition but didn't read the part where we told them the games were made by ai, so they said in the ai question free response that they would have completely changed their responses had they'd known. hence, not tagging any themes here as they'd misrepresent reality"
41,6501b789e3ddbc0a0b79b925,"The authenticity of the game was very apparent as it was a mix of strategy, timing and music all bundled up in one game. The game took different pieces of various categories and inputted it into either the visual game design or the mechanical game design. It was very intentional in its effort to create a genuine and novel game experience. 
",authentic/intentional,1,0,0,1,1,0,1,1,0,0,,
42,6501b789e3ddbc0a0b79b925,"The authenticity of the game was very clear, as it seemed like a novel concept that was crafted from the idea that the player would have to utilize their problem-solving skills in a fast-paced environment. The addition of monsters and time limits also showed the authenticity. The game also felt very intentional and very high effort, as it had a great aesthetic and a very personal feeling of hard work. ",authentic/intentional,1,1,0,1,1,0,1,1,0,0,,
48,6679a3b7cb020a6e4728eac5,"This game was creative and worked well, but it wasnt very authentic, most of the ""spy"" or stealth games have similar mechics, the original part of this one was the system to change the light position, allowing creating new ""bridges"" to complete the objetive, pretty similar with the puzzles of the very last Legend of Zeldas from Switch. The effort to develop this idea its good, maybe not the hardest prototype to develop but still interesting to play.",mixed,1,0,0,0,0,0,0,1,0,0,,didn't tag mechanics cuz the point was originality
50,6980c16f9985e39f6bcbbe3a,I haven't played this before so I think its a new idea which reflects the effort done to come up with the idea and create the game.,authentic/intentional,1,0,0,0,0,0,0,1,0,0,,
51,6980c16f9985e39f6bcbbe3a,Again I raise my hat to the idea of cutting throught the space. I haven't seen it before or even thought about it before. This means that the develope had spent alot of time thinking and managing to create such a game.,authentic/intentional,1,0,0,0,0,0,0,1,0,0,,
54,698a1701a5b02ba695e33055,"I feel like this game could have some potential with better graphic design and clear instructions of what to actually do, so it felt authentic and like some actual effort was put into the game unlike the 2 other games",authentic/intentional,0,0,0,2,0,0,0,1,2,0,,tagged accessibiliy and visual as negative because it seems the 'actual' authentic parts of the game were obstructed from the player because of the accessibility and visuals. they would've seen more authenticity if the visuals and accesibility were better
56,641359b5040c453203e2c088,"The game felt authentic because even though platforming is a common genre the light versus darkness theme gave it a genuine identity instead of feeling like a direct copy of another game. The visual style and focused concept showed that the developer had a clear idea they wanted to express.

In terms of intentionality the design choices such as the upward progression and the pressure from darkness felt purposeful rather than random. The difficulty curve and atmosphere suggested planning and thought behind the experience.

For effort the functionality and consistent theme showed solid work put into the mechanics and presentation. While the gameplay was somewhat simple it still demonstrated care in design and execution which made it feel thoughtfully developed.

",authentic/intentional,1,1,0,0,1,0,1,1,0,0,,
57,641359b5040c453203e2c088,"The game felt somewhat authentic because, although the mechanics are common, it still had a clear goal and consistent design that suggested the developer created it with purpose rather than just copying another game. In terms of intentionality, the level layouts and goal of reaching the green cube showed planning, even if the design was simple. The effort was evident in the functional controls and clean presentation, though the minimal graphics and basic mechanics suggest moderate rather than extensive development effort.",authentic/intentional,0,1,0,1,1,0,1,1,0,0,,
62,697944af338eef9df5fe1845,I think the game developer had some intresting ideas but got inspiration from previous popular games and put their own twist to it,mixed,1,0,0,0,0,0,1,0,0,0,,
63,697944af338eef9df5fe1845,"It felt genuine, I havent seen this type of concept before",authentic/intentional,1,0,0,0,0,0,0,0,0,0,,
64,61164e823465955346dc1827,excho location dark scene is totaly authentic to me,authentic/intentional,1,0,0,0,0,0,0,0,0,0,,
76,697fa6c649bf75696f73c7c0,"I think the game was authentic, I'd never seen anything like it, and the effort was well spent. In life we ​​face many obstacles and we have to overcome them.",authentic/intentional,1,0,0,0,0,0,0,1,0,0,,
78,697fa6c649bf75696f73c7c0,"The game was authentic; I'd seen some similar ones before, but none where it was possible to alter the characteristics. It reflected the developer's personal effort; we were able to overcome certain invisible barriers.",authentic/intentional,1,0,0,0,0,0,0,1,0,0,,
84,6577257c0f74c02eed5453c8,"It was clearly a creative decision to show the bird movement in the sky. The movement was clearly thought to make it simple and understandable. It was put effort on the diverse levels and obstacles and it considered the birds group behaviour. So, it had a funny and entertaining way to represent this idea. ",authentic/intentional,0,1,1,0,1,0,1,1,0,0,,
85,6987fbc16603cc742ebec4ec,the game has an idea that are different from other games.i was working in game testing and rating before and i say this game is so far one of the most original and genuine game without riping off any other games,authentic/intentional,1,0,0,0,0,0,0,1,0,0,,
88,669a65bbe45b41c3162d0d79,"Even tho other game may look similar the machinic and the aestetich felt pretty unique and mede the expierence feel prettu dtingued form other game wich might seems similar
",authentic/intentional,1,0,0,0,0,0,0,0,0,0,,
89,669a65bbe45b41c3162d0d79,It didn not felt like other games i've played or tried and the mechanic too is not widly explored in the videogame media,authentic/intentional,1,0,0,0,0,0,0,0,0,0,,
90,669a65bbe45b41c3162d0d79,Even tho the game shares teh base idea with other few games the twist on the mechanic make the game feel unique and like a great and fresh idea,authentic/intentional,1,0,0,0,0,0,0,0,0,0,,
94,5d3ce65a33b894000125909b,"I'm no expert but I haven't played a game where I needed to use both of my hands so it felt very original to me, also i loved the theme of like soulmates who can't keep that much apart ",authentic/intentional,1,1,0,0,0,0,1,0,0,0,theme/emotionally-resonant purpose contributed,
95,5d3ce65a33b894000125909b,"I give the developer points for character originality, but I didn't get the intention",mixed,1,0,0,0,0,0,2,0,0,0,,
96,5d3ce65a33b894000125909b,"I did think the author transmitted their message with the making of this game, it felt very authentic and original",authentic/intentional,1,0,0,0,0,0,1,1,0,0,ai not viewed as developer,
97,5e1b3b93f07b72359c0c4ffe,I think this is a unique game with unique mechanics I haven't played in a while,authentic/intentional,1,0,0,0,0,0,0,0,0,0,,
98,5e1b3b93f07b72359c0c4ffe,"the devs seems to have a unique and great idea, just need more tutorials and better graphics",mixed,1,0,0,2,0,0,0,0,2,0,,
102,699b19eb2744be8e2c9e73ed,"The graphics seemed like the part where the developer was most intentional. But the gameplay did not feel intentional and without any effort. The authenticity was there, as I have not seen a 2d top down defense game from an expanding wave.",mixed,1,0,0,1,2,0,2,2,0,0,,
105,69348f64be85265e846c5117,"quite authentic, but I do not think this game involve really much effort, while every ball sound and bounce differently.",mixed,0,0,0,0,0,0,0,2,0,0,,unclear what was authentic
114,6989da604f75e4c44ffefa17,great effort and seems authentic much but very hard and frustarting,mixed,0,0,2,0,0,0,0,1,0,0,,
118,66613916abcfcbe01b57b32a,It seemed to be an authentic well made game that was easy to navigate through and figure out,authentic/intentional,0,0,0,0,1,0,0,0,1,0,,
119,66613916abcfcbe01b57b32a,it was an authentic very challenging game,authentic/intentional,0,0,1,0,0,0,0,0,0,0,,
120,66613916abcfcbe01b57b32a,it was authentic and fun,authentic/intentional,0,0,1,0,0,0,0,0,0,0,,
121,566bdeb3beaf21001240085a,"Even though I thought of Elektroplankton, I haven't seen a game that combined that with gravity or with these objectives. I think that's the developer's idea, though I suppose they thought it would be more fun.",mixed,1,0,0,0,0,0,1,0,0,0,,
124,697d2057698dc9f0b71f0a43,"I believe that not much effort was put into making the game and its mechanics, but in terms of authenticity, I had never seen a game quite like it in terms of how it was put together, the way the enemies fought, and the way their attacks worked, especially the blue enemy. The others seemed quite authentic, and I believe it was easy to understand what the developer wanted to convey with the game.",mixed,1,0,0,0,0,0,1,2,0,0,,
126,697d2057698dc9f0b71f0a43,"I believe it took a lot of work to make, so the effort the developer put in was more than usual, and considering something like this for a game, it seems quite genuine. At least, I've never played anything like it before, and I found this mechanic interesting; it could be used to make a really cool and even more creative game.",authentic/intentional,1,0,0,0,1,0,0,1,0,0,,
133,693cb7531c138f131ae16026,It is not a rip off as I have never seen anything like this before? This game reflected high intentionality and personal effort as it is complicated strategically but original in its nature.,authentic/intentional,1,0,0,0,0,0,1,1,0,0,,
136,5c4684826a7dbc00017c0a87,"I found the game very authentic, it laid things bare and was fairly minimalistic, so there wasn't too many places for it to ""hide"". I think the game clearly has intentionality and effort put into it ",authentic/intentional,0,0,0,0,0,0,1,1,0,0,,
140,673e66683243bb7c85a17b5a,"I think the developer put genuine thought and work into this game, because i feel like its creative and has high potential to become an enjoyable puzzle game.",authentic/intentional,0,1,0,0,0,0,0,1,0,0,,
143,697bacf779007fb89caad347,"I think this game is truly authentic because I had never played anything similar before. I believe it's a very good game for training coordination between both hands, which also makes it exciting, since it gives you the feeling that playing it could actually benefit your brain health in some way. However, I don't think much effort was put into it. To begin with, the game didn't have a menu, you simply start playing and there aren't many explanations about why you are playing. It has no story and no real introduction. Tho objects and mechanic move well, and overall the game the game functions properly, but the design was far below my expectations. It wasn't visually appealing. ",mixed,1,0,1,2,0,0,2,2,2,0,,
155,69781e065ba9a4f5f1743c76,can be an interesting concept,unclear,0,1,0,0,0,0,0,0,0,0,,
169,68bb85dca4c5cc35b70f499b,the game was authentic and it was a good effort from developer.,authentic/intentional,0,0,0,0,0,0,0,1,0,0,,
170,68bb85dca4c5cc35b70f499b,the game feels authentic and it was a good effort from developer.,authentic/intentional,0,0,0,0,0,0,0,1,0,0,,
171,68bb85dca4c5cc35b70f499b,it was authentic and good effort from developer.,authentic/intentional,0,0,0,0,0,0,0,1,0,0,,
172,5d1f5c20aaa27b001954de31,it was looking unique of the playstyle especially the concept of drawing wherever i wanted so it was authentic and you could tell there was personal effort for it to become playable,authentic/intentional,1,0,0,0,0,0,0,1,0,0,,
174,5d1f5c20aaa27b001954de31,"it was a solid try and kinda unique approach,  i could see the producer touch in this game and his effort trying to build this ",authentic/intentional,1,0,0,0,0,0,1,1,0,0,,
176,699f6b2ff9170ee287ce9161,"The idea was clear and well executed, based on something that can be much more complicated; the intention to achieve that is evident.",authentic/intentional,0,1,0,0,0,0,1,0,0,0,,
177,699f6b2ff9170ee287ce9161,The idea is clear and intelligent with great potential if well executed.,authentic/intentional,0,1,0,0,0,0,0,0,0,0,,
178,60c13bce0d8616e48d044bd0,"As I mentioned earlier, it reminded me of another game I played a long time ago. But overall, I can't say I have seen many similar games. I think it requires a certain amount of creativity, and the mechanics are simple but with a noticeable difficulty curve. ",mixed,1,0,1,0,0,0,0,0,0,0,,
179,60c13bce0d8616e48d044bd0,"It's different and authentic, but I don't think much effort has been put into it. It's simple but complicated and not very well explained ",mixed,1,0,0,0,0,0,0,2,2,0,,
180,60c13bce0d8616e48d044bd0,"It's undoubtedly authentic in terms of its mechanics, and I believe that although not much effort has been put into its visual appearance, there is a very interesting tactical intention behind it.",mixed,0,0,0,2,1,0,1,0,0,0,,
182,60da6f47359a9fc411cc8313,The puzzle feels original and intentional.,authentic/intentional,1,0,0,0,0,0,1,0,0,0,,
